commit	group_commit_throughput	append_consistent_p99_ns	e2e_p50_ns	e2e_p99_ns	memory_kb	status	description
2249b81	59701.72	566379	0	823101	0	keep	baseline champion (no change): group_commit_throughput=59701.7/s, append_consistent_p99=566379ns, gate e2e_p99=823101ns PASS, torture green
1582f07	43916	448667	0	0	0	discard	Arc<[u8]> shared payload (eliminate 2nd per-append Vec alloc): primary median-of-5=43916/s vs champ 59701 (NO improvement; samples 37627-62951, +-2x sandbox noise, distributions overlap); append_p99 improved 448667 vs 566379; gate auto-skipped (not plausible); reverted
53dfe44	51505	454996	453384	841085	0	keep	re-baseline champion under p50 median-of-N gate: primary median-of-7=51505/s (samples 38990-69163, +-30% host noise); append_consistent_p99=454996ns; gate e2e_p50=453384ns e2e_p99=841085ns PASS. Establishes p50 gate baseline (pre-rework rows have e2e_p50=0); champion journal code unchanged from 2249b81
fec3094	62341	558308	455897	800221	0	keep	fsync re-drain coalescing (writer_loop Consistent arm: re-drain channel after write_batch, before fsync, up to 4 rounds; one fsync covers original batch + newcomers): primary median-of-7=62341/s vs champ 51505 (+21%; samples 57660-77894, candidate min>champ median, distributions cleanly separated); gate e2e_p50=455897 vs 453384 (+0.55%, flat) PASS; append_p99 558308 (secondary, noisy); 96 journal tests + torture green
4fcb939	195408	850079	447514	799639	0	keep	dup-fd fsync: fsync a try_clone'd fd, release state.lock across sync_all so producers enqueue during the fsync window; re-drain then coalesces the whole backlog into the next fsync. primary median-of-7=195408/s vs champ 62341 (+213%; samples 182272-224378, candidate min 182272 = 2.6x champ max, distributions fully disjoint); gate e2e_p50=447514 vs 455897 (-1.8%, improved) e2e_p99=799639 (flat) PASS; append_consistent_p99=850079 (secondary, up from larger batches; cluster e2e p99 flat); journal crash/truncation/durability suite + frozen torture green
4fcb939	205396	607887	453574	781315	0	discard	encode/CRC32 outside state.lock (split append_records into encode + write_encoded; off-lock crc32fast pass into reusable scratch buffer; lock only for fence/rotation/seek/write_all): primary median-of-7=205396/s vs champ 195408 (WASH, +5% within noise; candidate 187-216k overlaps champ 182-224k); append_p99 median-of-7=607887 vs champ single 850079 (modest ~28% but noisy, candidate spans 526-799k); gate e2e_p50=453574 (+1.35%) e2e_p99=781315 PASS; full journal durability suite green. DISCARD: no robust primary gain to justify added complexity. NOTE latency signal worth a future latency-primary campaign
